Audio guide Number,Title of work,Artist last name,Artist first name,Date,Gallery number,Summary,Comments,Keep?
269,The Cat's Paw,Landseer,Sir Edwin Henry,1824,321,"Describes how Landseer's interpretation of the fabel is more brutal than the 
scene depicted in the original fabel.",,Yes
038,Caretaker's Cottage in the Forest of Compiegne,Huet,Paul,1826,321,"Discusses French landscape painting and where this artwork fits into-and 
breaks with- the traditions.","The audio is an excellent companion to the
object label",Yes
541,"The Fallen Branch, Fontainebleau",Michallon,Achille Etna,1816,321,"Discusses how you can tell when landscape artists are painting directly from
nature based on the light.","Learning to look at the way artists used light 
in landscapes as a determination of whether
they were painting directly from nature, or just 
in the studio was fascinating; and it's something 
the visitor can carry over into other paintings",Yes
840,Icarus Making Trial of His Wings,Grasse,Philippe,1831,321,"Describes how the rise Romaticism influenced Grasse's subject choice of 
Icarus",,Yes
517,Fontainebleau Oaks,Dupre,Jules,1840,321,Descibes how this work had a 'freshness' not formerly seen in French painting,"I liked how it went on to highlight the specific
techniques Dupre used to achieve 'freshness'",Yes
044,Destruction of the Beast and the False Prophet,West,Benjamin,1804,321,"Describes how Romanticism allowed artists to capture enormity of nature
and humans in turmoil; it is more than a biblical story",,Yes
037,Silenus,Corot,Jean-Baptiste-Camille,1838,321,Describes how Corot reconciles an elevated subject in a natural setting,"I am left with the question of ""how was it a 
homage to the academic painting tradition""",Yes
132,Deer in the Forest,Corbet,Gustave,1868,321,"Discusses how this was the first major European painting to enter the MIA's
collection; goes on to mention James J. Hill. ",I found the object label to be more engaging,Yes
935,Deer in the Forest,Corbet,Gustave,1868,321,,"""""",X
731,Deer in the Forest,Corbet,Gustave,1868,321,,"""""",X
035,Seated Shepherdess,Millet,Jean-Francois,1852,321,"Discusses how the Academie in 19th c. France dictated what subjects 
artistscould use. Goes on to talk about Millet's method of choosing the 
shepherdess.",,Yes
518,"The Crossroads of the Eagle’s Nest, Fontainebleau Forest",Daubigny,Charles-Francois,1843,321,Describes the technique used by Daubigny,Not on view (01/27/16),Yes
036,Les Trois Grâces (The Three Graces),Carpeaux,Jean-Baptiste,1872,321,"Describes how Carpeaux caused a public outcry with his departure from neo-
classical scultpure",Reiterates what is stated on the object label,No
131,Self-Portrait with Dr. Arrieta,Goya,Fransisco Jose,1820,321,Describes the circumstances behind the subject matter,"Not on view (01/27/2016). 
Similar to the object label.",Yes
721,Self-Portrait with Dr. Arrieta,Goya,Fransisco Jose,1820,321,,"""""",X
729,Convulsionists of Tangier,Delacroix,Eugene,1837,321,No audio available online,Not on view (01/27/2016). ,X
850,Isles of Shoals,Hassam,Childe,1899,322,"Discusses the influence Impressionists had on Hassam; and the different 
ways that influence is present in the painting.",,Yes
228,The Butterfly Catchers,Wendel,Theodore,1900,322,"Discusses Wendel's inspiration for the painting and his studies with 
European Impressionist painters",,Yes
034,"The Bronze Horses of San Marco, Venice",Coleman,Charles Caryl,1876,323,Discusses the choice of subject,"Enjoyed likening the painting to a ""postcard""",Yes
533,Quiet Seascape,Richards,William Trost,1883,323,Discusses the composition of the piece,"Loved the sound of the sea in the background;
it really sets the mood and draws you into the 
painting",Yes
537,"Girl by a Stream, Flanders",Knight,Daniel Ridgeway,1890,323,No audio available online,No audio available online ,X
226,Medusa,Hosmer,Harriet Goodhue,1854,323,Tells the mythology behind Medusa,"I wish it would talk in depth about why Hosmer
chose to portray Medusa in the midst of the 
transformation.",Yes
468,Bust of a Greek Slave,Powers,Hiram,1845,323,Discusses how the subject choice was a commentary on slavery,,Yes
453,Reminiscences of 1865,Peto,John Frederick,1904,323,Discusses the effects of the Civil War on the American psyche,"Not on view (01/27/2016); pairs quite well with
the object label",Yes
750,Catskill Mountain House,Cropsey,Jasper Francis,1855,323,"Discusses the idealized landscape, the hotel, and Hidson River School
artists.",,Yes
535,A Scene on the Tohickon Creek: Autumn,Moran,Thomas,1868,323,Briefly mentions Moran's more famous works; discusses his mastery of color,,Yes
005,The Merced River in Yosemite,Bierstadt,Albert,1868,323,Discusses Bierstadt's experiences in Yosemite,"I liked how it encouraged you to compare this
work with the scroll paintings in the Chinese
galleries. ",Yes
,"Anne, Countess of Strafford",Reynolds,Sir Joshua,1758–59,G324,,,
,Portrait of James Ward,Stuart,Gilbert,1779,G324,,,
,Tudor room,Unknown ,Unknown,c. 1600,G325,,,
,Queen Anne room,Unknown,Unknown,c. 1720-1730,G326,,,
,Georgian drawing room,Unknown,Unknown,c. 1740,G327,,,
,The Immaculate Conception with Saints Francis of Assisi and Anthony of Padua,Castiglione (Il Grechetto),Giovanni Benedetto ,1649–50,G330,,,
,Erminia and the Shepherds, (Giovanni Francesco Barbieri),Guercino ,1648–49,G330,,,
,Saint Humphrey (Onuphrius),Rosa,Salvator,c. 1660,G330,,,
,Diana the Huntress,Battista Gaulli (Baciccio),Giovanni ,c. 1690,G330,,,
,Funeral torch,Unknown,Unknown,c. 1720,G330,,,
,Lady at Her Toilet,Unknown,Unknown,c. 1650-1660,G330,,,
,Venus and Adonis,Mignard (Mignard d'Avignon),Nicolas ,c. 1650,G330,,,
,Salome with the Head of Saint John the Baptist,Marinari,Onorio ,1670s,G330,,,
,Odd Fellows ceremonial ark,Unknown,Unknown,1856,G331,,,
,Connecticut room,Unknown,Unknown,c. 1740,G331,,,
,Portrait of George Washington,Sully,Thomas,c. 1820,G332,,,
,Bust of George Washington,Powers,Hiram,c. 1853,G332,,,
,Desk and bookcase,,Attributed to Meads and Alvord,c. 1832-1834,G332,,,
,Puzzle jug,Unknown,Unknown,c. 1750,G332,,,
,"Delft shoe, one of a pair",Unknown,Unknown,1720,G332,,,
,Basin with Hercules and Cacus,Fontana,Orazio,c. 1570,G332,,,
,Pitcher,Walker,Andrew Craig,1826-1832,G333,,,
,Goblet,Beilby,William ,c. 1770,G333,,,
,Perfume bottle,,Stiegal Glass Works,c. 1780,G333,,,
,"Cabbage tureen, cover and stand",Unknown,Unknown,before 1754,G333,,,
,Biedermeier secretary,unknown,unknown,1834,G333,,,
,Portrait of Elizabeth L. Burton,Eakins,Thomas,1905-1906,G334,,,
,Dream Castle in the Sky,Parrish,Maxfield,1908,G334,,,
,Illustration for Canto XI of the 'Rubáiyaát of Omar Khayyám',Brangwyn,Frank William,c. 1912,G334,,,
,Side cabinet,Northmore ,Augustus Welby,c. 1850,G334,,,
,Providence parlour,Unknown,Unknown,c. 1760-1770,G335,,,
,Charleston Drawing Room,Unknown,Unknown,1772,G336,,,
,Charleston dining room,Unknown,Unknown,1772,G337,,,
,,,,,G340,,,
,,,,,G340,,,
,,,,,G340,,,
,,,,,G340,,,
,,,,,G340,,,
,,,,,G340,,,
,,,,,G340,,,