"id","object_id","media_url","title","in_gallery_version","audio_stop_number","stop_type","","",""
"620","2487","http://audio-tours.s3.amazonaws.com/w688.mp3","Portrait of Catherine Coustard (1673-1728), Marquise of Castelnau, Wife of Charles-Léonor Aubry (1667-1735) with her Son Léonor (1695-1770) by Nicolas de Largillière","0","","","","",""
"621","3059","http://audio-tours.s3.amazonaws.com/w689.mp3","Penitent Magdelene by Bartolomé Esteban Murillo","0","","","","",""
"622","3076","http://audio-tours.s3.amazonaws.com/w690.mp3","The Asparagus Vendor by Pieter de Hooch","0","","","","",""
"623","3729","http://audio-tours.s3.amazonaws.com/w691.mp3","Castle and Watermill by a River by Jacob van Ruisdael","0","","","","",""
"624","3221","http://audio-tours.s3.amazonaws.com/w692.mp3","River Landscape with the Pellecussen Gate near Utrecht by Jan van Goyen","0","","","","",""
"625","3115","http://audio-tours.s3.amazonaws.com/w693.mp3","Fishing Vessels Offshore in a Heavy Sea by Ludolph Backhuysen","0","","","","",""
"626","24026","http://audio-tours.s3.amazonaws.com/w694.mp3","Kast or Zeeuws cupboard","0","","","","",""
"627","8428","http://audio-tours.s3.amazonaws.com/w697.mp3","Desk by Ilonka Karasz","0","","","","",""
"628","1488","http://audio-tours.s3.amazonaws.com/w698.mp3","Self - Portrait by Francesco de Mura","0","","","","",""
"629","8776","http://audio-tours.s3.amazonaws.com/w699.mp3","Diogenes by Johann Carl Loth","0","","","","",""
"630","83458","http://audio-tours.s3.amazonaws.com/w700.mp3","Waa-Pa-Shaw, A Sioux Chief, from McKenney and Hall's ""History of the Indian Tribes of North America"" by Charles Bird King","0","","","","",""
"631","1957","http://audio-tours.s3.amazonaws.com/w704.mp3","View of a Town House Garden in The Hague by Paulus Constantijn la Fargue","0","","","","",""
"632","1348","http://audio-tours.s3.amazonaws.com/w706.mp3","The Death of Germanicus by Nicolas Poussin","0","","","","",""
"633","1463","http://audio-tours.s3.amazonaws.com/w707.mp3","Pope Benedict XIV presenting the Encyclical 'Ex Omnibus' to the Comte de Stainville, later Duc de Choiseul by Pompeo Girolamo Batoni","0","","","","",""
"634","72","http://audio-tours.s3.amazonaws.com/w708.mp3","Head of a Philosopher by Giovanni Domenico Tiepolo","0","","","","",""
"635","529","http://audio-tours.s3.amazonaws.com/w709.mp3","Lucretia by Rembrandt Harmensz van Rijn","0","","","","",""
"636","8023","http://audio-tours.s3.amazonaws.com/w710.mp3","Pier Table by Giovanni Battista Piranesi","0","","","","",""
"637","1727","http://audio-tours.s3.amazonaws.com/w712.mp3","Portrait of Mlle. Lange as Danae by Anne-Louis Girodet de Roucy-Trioson","0","","","","",""
"638","2420","http://audio-tours.s3.amazonaws.com/w713.mp3","Venetian Writing Desk","0","","","","",""
"639","1451","http://audio-tours.s3.amazonaws.com/w714.mp3","Wine Cistern by Paul de Lamerie","0","","","","",""
"640","1748","http://audio-tours.s3.amazonaws.com/w715.mp3","Coaci, Inkstand","0","","","","",""
"641","5057","http://audio-tours.s3.amazonaws.com/w716.mp3","Fecundity dish","0","","","","",""
"642","1520","http://audio-tours.s3.amazonaws.com/w717.mp3","Stoup (holy water basin) by Giovanni Giardini da Forli","0","","","","",""
"643","593","http://audio-tours.s3.amazonaws.com/w718.mp3","Portrait of Sarah Allen, née Sargent (1729-1792) by John Singleton Copley","0","","","","",""
"644","5771","http://audio-tours.s3.amazonaws.com/w719.mp3","Side Cabinet Attributed to Augustus Welby Northmore Pugin","0","","","","",""
"645","1226","http://audio-tours.s3.amazonaws.com/w721.mp3","Self-Portrait with Dr. Arrieta by Francisco Jose de Goya y Lucientes","0","","","","",""
"646","11955","http://audio-tours.s3.amazonaws.com/w722.mp3","St. Jerome by Adam Lenckhardt","0","","","","",""
"647","4441","http://audio-tours.s3.amazonaws.com/w723.mp3","Elevator Grilles, Frieze, and Overgrille by Louis Henri Sullivan","0","","","","",""
"648","2127","http://audio-tours.s3.amazonaws.com/w724.mp3","Jonathan's Token to David by Frederic, Lord Leighton","0","","","","",""
"649","1272","http://audio-tours.s3.amazonaws.com/w725.mp3","Port-en-Bessin by Georges Seurat","0","","","","",""
"650","3740","http://audio-tours.s3.amazonaws.com/w726.mp3","Portrait of Catharina van Voorst (1595-1650) and Portrait of Lucas van Voorst (1590-1669) by Paulus Moreelse","0","","","","",""
"651","3741","http://audio-tours.s3.amazonaws.com/w726.mp3","Portrait of Catharina van Voorst (1595-1650) and Portrait of Lucas van Voorst (1590-1669) by Paulus Moreelse","0","","","","",""
"652","1227","http://audio-tours.s3.amazonaws.com/w727.mp3","The Attributes of the Arts and the Rewards Which Are Accorded Them by Jean-Baptiste-Siméon Chardin","0","","","","",""
"653","1163","http://audio-tours.s3.amazonaws.com/w728.mp3","The Piazza San Marco, Venice by Pierre Auguste Renoir","0","","","","",""
"654","1978","http://audio-tours.s3.amazonaws.com/w729.mp3","Fanatics of Tangier by Eugène Delacroix","0","","","","",""
"655","1655","http://audio-tours.s3.amazonaws.com/w730.mp3","Nude on a Couch by Gustave Caillebotte","0","","","","",""
"656","53","http://audio-tours.s3.amazonaws.com/w731.mp3","Deer in the Forest by Gustave Courbet","0","","","","",""
"657","1782","http://audio-tours.s3.amazonaws.com/w732.mp3","Madonna of the Martyrs by Francesco Solimena","0","","","","",""
"658","1849","http://audio-tours.s3.amazonaws.com/w733.mp3","The Prodigal Son by Pier Leone Ghezzi","0","","","","",""
"659","78","http://audio-tours.s3.amazonaws.com/w734.mp3","Portrait of an Ecclesiastic by Giovanni Battista Moroni","0","","","","",""
"660","1617","http://audio-tours.s3.amazonaws.com/w736.mp3","Arms of Pope Paul III (reigned 1534-49)","0","","","","",""
"661","1637","http://audio-tours.s3.amazonaws.com/w738.mp3","The Church at Chailly by Jean-François Millet","0","","","","",""
"662","1816","http://audio-tours.s3.amazonaws.com/w739.mp3","Wet Pasture by Narcisse-Virgile Diaz de la Peña","0","","","","",""
"663","10436","http://audio-tours.s3.amazonaws.com/w740.mp3","Grainstack, Sun in the Mist by Claude Monet","0","","","","",""
"664","1218","http://audio-tours.s3.amazonaws.com/w741.mp3","Olive Trees by Vincent van Gogh","0","","","","",""
"665","1240","http://audio-tours.s3.amazonaws.com/w742.mp3","Dining Room in the Country by Pierre Bonnard","0","","","","",""
"666","601","http://audio-tours.s3.amazonaws.com/w744.mp3","I Raro Te Oviri (Under the Pandanus) by Paul Gauguin","0","","","","",""
"667","10361","http://audio-tours.s3.amazonaws.com/w745.mp3","The Carpet Merchant by Jean-Léon Gérôme","0","","","","",""
"668","1665","http://audio-tours.s3.amazonaws.com/w748.mp3","The Trinity with Souls in Purgatory by Corrado Giaquinto","0","","","","",""
"669","3584","http://audio-tours.s3.amazonaws.com/w749.mp3","Still Life with Fruits, Foliage and Insects by Abraham Mignon","0","","","","",""
"670","452","http://audio-tours.s3.amazonaws.com/w750.mp3","Catskill Mountain House by Jasper Francis Cropsey","0","","","","",""
"671","58166","http://audio-tours.s3.amazonaws.com/w751.mp3","Cover by Theresa Handy","0","","","","",""
"672","1704","http://audio-tours.s3.amazonaws.com/w752.mp3","Tahkt-I-Sulayman Variation II by Frank Stella","0","","","","",""
"673","13074","http://audio-tours.s3.amazonaws.com/w753.mp3","Gattenom by Frank Stella","0","","","","",""
"674","65023","http://audio-tours.s3.amazonaws.com/w754.mp3","Besides as Before by Steven Sorman","0","","","","",""
"675","2749","http://audio-tours.s3.amazonaws.com/w755.mp3","Landscape with Cross by Peter Lanyon","0","","","","",""
"676","3220","http://audio-tours.s3.amazonaws.com/w756.mp3","Horse and Rider","0","","","","",""
"677","1354","http://audio-tours.s3.amazonaws.com/w757.mp3","Bronze by Philip Guston","0","","","","",""
"678","5054","http://audio-tours.s3.amazonaws.com/w760.mp3","Library Table by Thomas Hope","0","","","","",""
"679","2900","http://audio-tours.s3.amazonaws.com/w761.mp3","James J. Hill Presentation Tray by Tiffany and Company","0","","","","",""
"680","61478","http://audio-tours.s3.amazonaws.com/w763.mp3","Project by Ben Nicholson","0","","","","",""
"681","1595","http://audio-tours.s3.amazonaws.com/w764.mp3","Composition with Blue, Red, Yellow, and Black by Piet Mondrian","0","","","","",""
"682","1887","http://audio-tours.s3.amazonaws.com/w768.mp3","Madeleine I by Henri Matisse","0","","","","",""
"683","62046","http://audio-tours.s3.amazonaws.com/w770.mp3","""Wassily"" armchair, model B3 by Marcel Lajos Breuer","0","","","","",""
"684","4841","http://audio-tours.s3.amazonaws.com/w771.mp3","Writing Desk on Stand","0","","","","",""
"685","8031","http://audio-tours.s3.amazonaws.com/w772.mp3","Cabbage Tureen, Cover and Stand","0","","","","",""
"686","3908","http://audio-tours.s3.amazonaws.com/w773.mp3","Basin with Apollo and the Muses by Orazio Fontana","0","","","","",""
"687","8552","http://audio-tours.s3.amazonaws.com/w775.mp3","Roman Mirror","0","","","","",""
"688","329","http://audio-tours.s3.amazonaws.com/w776.mp3","Southwest Chest","0","","","","",""
"689","3527","http://audio-tours.s3.amazonaws.com/w777.mp3","Jewelry Box by Giovanni Battista Foggini","0","","","","",""
"690","8566","http://audio-tours.s3.amazonaws.com/w778.mp3","Schrank (cabinet)","0","","","","",""
"691","3545","http://audio-tours.s3.amazonaws.com/w779.mp3","Miniature Frame","0","","","","",""
"692","8024","http://audio-tours.s3.amazonaws.com/w780.mp3","Charleston Drawing Room","0","","","","",""
"693","8278","http://audio-tours.s3.amazonaws.com/w781.mp3","Connecticut Room","0","","","","",""
"694","19404","http://audio-tours.s3.amazonaws.com/w782.mp3","McFarlane Room/ Wallpaper","0","","","","",""
"695","9668","http://audio-tours.s3.amazonaws.com/w783.mp3","Queen Anne Room","0","","","","",""
"696","14863","http://audio-tours.s3.amazonaws.com/w784.mp3","Georgian Drawing Room","0","","","","",""
"697","14157","http://audio-tours.s3.amazonaws.com/w785.mp3","Tudor room","0","","","","",""
"698","14019","http://audio-tours.s3.amazonaws.com/w786.mp3","Providence Parlour","0","","","","",""
"699","1423","http://audio-tours.s3.amazonaws.com/w788.mp3","Woman by the Sea by Pablo Picasso","0","","","","",""
"700","1556","http://audio-tours.s3.amazonaws.com/w789.mp3","Hardy Plants by Paul Klee","0","","","","",""
"701","1513","http://audio-tours.s3.amazonaws.com/w790.mp3","Composition by Arshile Gorky","0","","","","",""
"702","1513","http://audio-tours.s3.amazonaws.com/w792.mp3","Abstract Expressionism","0","","","","",""
"703","1378","http://audio-tours.s3.amazonaws.com/w794.mp3","The Gamblers by Hendrick ter Brugghen","0","","","","",""
"704","5566","http://audio-tours.s3.amazonaws.com/w795.mp3","Hanukkah Lamp","0","","","","",""
"705","13202","http://audio-tours.s3.amazonaws.com/w796.mp3","Torah Crown","0","","","","",""
"706","5604","http://audio-tours.s3.amazonaws.com/w797.mp3","Yad (Torah pointer)","0","","","","",""
"707","101065","http://audio-tours.s3.amazonaws.com/w798.mp3","Havdalah Set","0","","","","",""
"708","5556","http://audio-tours.s3.amazonaws.com/w799.mp3","Tzedakah (righteousness) Box","0","","","","",""
"709","4725","http://audio-tours.s3.amazonaws.com/w803.mp3","Coffee and Tea Service by Jean Puiforcat","0","","","","",""
"710","1280","http://audio-tours.s3.amazonaws.com/w804.mp3","The Tiber Muse by the Graeco-Roman Culture","0","","","","",""
"711","1740","http://audio-tours.s3.amazonaws.com/w805.mp3","Elephant Attacking a Feline, Syrian","0","","","","",""
"712","77437","http://audio-tours.s3.amazonaws.com/w806.mp3","Shallow Bowl, Roman, and Cup, Syrian","0","","","","",""
"713","61289","http://audio-tours.s3.amazonaws.com/w806.mp3","Shallow Bowl, Roman, and Cup, Syrian","0","","","","",""
"714","3218","http://audio-tours.s3.amazonaws.com/w807.mp3","Athenian Red-figure Volute Krater Attributed to the Methyse Painter","0","","","","",""
"715","6028","http://audio-tours.s3.amazonaws.com/w808.mp3","Portrait of the Pharaoh Amenhotep III, Egyptian","0","","","","",""
"716","100","http://audio-tours.s3.amazonaws.com/w809.mp3","Model Boat and Figures, Egyptian","0","","","","",""
"717","31163","http://audio-tours.s3.amazonaws.com/w811.mp3","Censer","0","","","","",""
"718","95595","http://audio-tours.s3.amazonaws.com/w812.mp3","Camels and Driver","0","","","","",""
"719","17047","http://audio-tours.s3.amazonaws.com/w814.mp3","Dragon Robe","0","","","","",""
"720","16950","http://audio-tours.s3.amazonaws.com/w815.mp3","Taoist Robe","0","","","","",""
"721","16945","http://audio-tours.s3.amazonaws.com/w815.mp3","Taoist Robe","0","","","","",""
"722","609","http://audio-tours.s3.amazonaws.com/w815.mp3","Taoist Robe","0","","","","",""
"723","10483","http://audio-tours.s3.amazonaws.com/w816.mp3","Imperial Portrait of Prince Duo-Lo","0","","","","",""
"724","1533","http://audio-tours.s3.amazonaws.com/w817.mp3","Madonna and Child","0","","","","",""
"725","1367","http://audio-tours.s3.amazonaws.com/w818.mp3","Pope Liberius Baptizing the Neophytes by Alessandro Algardi","0","","","","",""
"726","12144","http://audio-tours.s3.amazonaws.com/w819.mp3","Madonna Enthroned in Majesty with the Christ Child","0","","","","",""
"727","11957","http://audio-tours.s3.amazonaws.com/w820.mp3","The Entombment of Christ","0","","","","",""
"728","5896","http://audio-tours.s3.amazonaws.com/w824.mp3","Yombe mask","0","","","","",""
"729","2753","http://audio-tours.s3.amazonaws.com/w825.mp3","Center Table by Hans Daniel Sommer","0","","","","",""
"730","8156","http://audio-tours.s3.amazonaws.com/w826.mp3","Standing Salt by Christopher Eston","0","","","","",""
"731","1238","http://audio-tours.s3.amazonaws.com/w827.mp3","Drinking Cup by Joerg Ruel","0","","","","",""
"732","6030","http://audio-tours.s3.amazonaws.com/w828.mp3","Card Table by William Burges","0","","","","",""
"733","8951","http://audio-tours.s3.amazonaws.com/w830.mp3","Posset Pot","0","","","","",""
"734","8946","http://audio-tours.s3.amazonaws.com/w831.mp3","Puzzle Jug","0","","","","",""
"735","8948","http://audio-tours.s3.amazonaws.com/w832.mp3","Berber's Bowl","0","","","","",""
"736","8949","http://audio-tours.s3.amazonaws.com/w833.mp3","Pair of Shoes","0","","","","",""
"737","19689","http://audio-tours.s3.amazonaws.com/w834.mp3","Hallway by Frank Lloyd Wright","0","","","","",""
"738","31247","http://audio-tours.s3.amazonaws.com/w835.mp3","Model of original scheme for the Minneapolis Society of Fine Arts, Charles Follen McKim, Architect","0","","","","",""
"739","2144","http://audio-tours.s3.amazonaws.com/w840.mp3","Icarus Making Trial of His Wings by Philippe Grasse","0","","","","",""
"740","2034","http://audio-tours.s3.amazonaws.com/w841.mp3","Psyche Abandoned by Augustin Pajou","0","","","","",""
"741","4505","http://audio-tours.s3.amazonaws.com/w842.mp3","Leda and the Swan by Albert-Ernest Carrier-Belleuse","0","","","","",""
"742","4696","http://audio-tours.s3.amazonaws.com/w843.mp3","Flora Kneeling by Jean-Baptiste Carpeaux","0","","","","",""
"743","2036","http://audio-tours.s3.amazonaws.com/w844.mp3","Pair of Torchères by Albert-Ernest Carrier-Belleuse","0","","","","",""
"744","1727","http://audio-tours.s3.amazonaws.com/w845.mp3","Portrait of Mlle. Lange as Danae by Anne-Louis Girodet de Roucy-Trioson","0","","","","",""
"745","2622","http://audio-tours.s3.amazonaws.com/w846.mp3","Italian Skeleton Funeral Torch","0","","","","",""
"746","5365","http://audio-tours.s3.amazonaws.com/w847.mp3","Assorted Delftware","0","","","","",""
"747","5362","http://audio-tours.s3.amazonaws.com/w847.mp3","Assorted Delftware","0","","","","",""
"748","8962","http://audio-tours.s3.amazonaws.com/w847.mp3","Assorted Delftware","0","","","","",""
"749","45","http://audio-tours.s3.amazonaws.com/w850.mp3","Isles of Shoals by Frederick Childe Hassam","0","","","","",""
"750","1385","http://audio-tours.s3.amazonaws.com/w851.mp3","Mrs. T. in Cream Silk, No.2 by George Bellows","0","","","","",""
"751","1318","http://audio-tours.s3.amazonaws.com/w852.mp3","Howling Dog by Paul Klee","0","","","","",""
"752","1355","http://audio-tours.s3.amazonaws.com/w853.mp3","Study For Portrait VI by Francis Bacon","0","","","","",""
"753","3291","http://audio-tours.s3.amazonaws.com/w854.mp3","Portrait of Juan de Pareja, the Assistant to Velázquez by Salvador Dali","0","","","","",""
"754","22091","http://audio-tours.s3.amazonaws.com/w855.mp3","Boreas Abducting Orithyia after Gaspard Marsy","0","","","","",""
"755","3685","http://audio-tours.s3.amazonaws.com/w857.mp3","Portuguese Desk and Chair","0","","","","",""
"756","3737","http://audio-tours.s3.amazonaws.com/w858.mp3","""Persian Arabesque"" Window by John La Farge","0","","","","",""
"757","111","http://audio-tours.s3.amazonaws.com/w859.mp3","Wedding chest (Cassone)","0","","","","",""
"758","1517","http://audio-tours.s3.amazonaws.com/w860.mp3","Woman in an Armchair by Pablo Picasso","0","","","","",""
"759","54","http://audio-tours.s3.amazonaws.com/w861.mp3","Kneeling Saint","0","","","","",""
"760","1555","http://audio-tours.s3.amazonaws.com/w862.mp3","Head of a Woman by Joan Miró","0","","","","",""
"761","1693","http://audio-tours.s3.amazonaws.com/w863.mp3","Ptolemaic Ruler in the Guise of Hercules, Graeco-Egyptian","0","","","","",""
"762","1751","http://audio-tours.s3.amazonaws.com/w864.mp3","Roman Silver Venus","0","","","","",""
"763","1474","http://audio-tours.s3.amazonaws.com/w865.mp3","Roman Cinerary Box with Cover","0","","","","",""
"764","293","http://audio-tours.s3.amazonaws.com/w866.mp3","Greek Crouching Lion","0","","","","",""
"765","3520","http://audio-tours.s3.amazonaws.com/w868.mp3","The Doryphoros, Roman","0","","","","",""
"766","5057","http://audio-tours.s3.amazonaws.com/w871.mp3","Fecundity dish","0","","","","",""
"767","3736","http://audio-tours.s3.amazonaws.com/w872.mp3","Vase by Chelsea Porcelain Manufactory","0","","","","",""
"768","8362","http://audio-tours.s3.amazonaws.com/w873.mp3","Covered Vases by Manufacture Nationale de Sèvres","0","","","","",""
"769","32465","http://audio-tours.s3.amazonaws.com/w874.mp3","Chest by Ivar Kvalen (Quallen)","0","","","","",""
"770","1506","http://audio-tours.s3.amazonaws.com/w875.mp3","Chrysanthemum' candelabrum by Charles T. Grosjean","0","","","","",""
"771","89655","http://audio-tours.s3.amazonaws.com/w876.mp3","Shirt, A'aninin/ Nakoda (Gros Ventre/ Assiniboine)","0","","","","",""
"772","3734","http://audio-tours.s3.amazonaws.com/w877.mp3","Triptych with the Madonna and Child, Saints, and Prophets by Pierre Reymond","0","","","","",""
"773","522","http://audio-tours.s3.amazonaws.com/w878.mp3","Portrait of Luca Salvioni by Agostino Zoppo","0","","","","",""
"774","1554","http://audio-tours.s3.amazonaws.com/w881.mp3","Pedernal - From the Ranch #1 by Georgia O'Keeffe","0","","","","",""
"775","18426","http://audio-tours.s3.amazonaws.com/w882.mp3","Calendar Plate (October) by Pierre Reymond","0","","","","",""
"776","1219","http://audio-tours.s3.amazonaws.com/w883.mp3","Married Life by Roger de la Fresnaye","0","","","","",""
"777","45640","http://audio-tours.s3.amazonaws.com/w884.mp3","Corinthian Helmet, Greek","0","","","","",""
"778","351","http://audio-tours.s3.amazonaws.com/w886.mp3","Cypriot Votary Figure, Greek","0","","","","",""
"779","1337","http://audio-tours.s3.amazonaws.com/w887.mp3","Relief of Beseiged Fortress from Nimrud, Assyrian","0","","","","",""
"780","1346","http://audio-tours.s3.amazonaws.com/w888.mp3","Striding Male Figure, Egyptian","0","","","","",""
"781","103","http://audio-tours.s3.amazonaws.com/w889.mp3","Funerary Mask of a Young Woman and Portrait Mask of a Bearded Man, Egyptian","0","","","","",""
"782","2077","http://audio-tours.s3.amazonaws.com/w889.mp3","Funerary Mask of a Young Woman and Portrait Mask of a Bearded Man, Egyptian","0","","","","",""
"783","1502","http://audio-tours.s3.amazonaws.com/w892.mp3","Head of a Woman by Amedeo Modigliani","0","","","","",""
"784","1356","http://audio-tours.s3.amazonaws.com/w893.mp3","The Avenger by Ernst Barlach","0","","","","",""
"785","10422","http://audio-tours.s3.amazonaws.com/w896.mp3","Still Life by Juan Gris","0","","","","",""
"786","1941","http://audio-tours.s3.amazonaws.com/w897.mp3","The Scholar's Playthings by Giorgio de Chirico","0","","","","",""
"787","1852","http://audio-tours.s3.amazonaws.com/w898.mp3","The Village by Albert Gleizes","0","","","","",""
"788","1639","http://audio-tours.s3.amazonaws.com/w899.mp3","Study For Improvisation V by Vassily Kandinsky","0","","","","",""
"789","1888","http://audio-tours.s3.amazonaws.com/w900.mp3","Large Seated Nude by Henri Matisse","0","","","","",""
"790","4530","http://audio-tours.s3.amazonaws.com/w901.mp3","Garamut (Slit Drum)","0","","","","",""
"791","4343","http://audio-tours.s3.amazonaws.com/w903.mp3","Jade Pillow","0","","","","",""
"792","12134","http://audio-tours.s3.amazonaws.com/w905.mp3","Library and Rock Garden, The Studio of Gratifying Discourse","0","","","","",""
"793","5623","http://audio-tours.s3.amazonaws.com/w906.mp3","Prancing Celestial Horse","0","","","","",""
"794","4793","http://audio-tours.s3.amazonaws.com/w907.mp3","Funerary Model of a Pig Sty","0","","","","",""
"795","5473","http://audio-tours.s3.amazonaws.com/w908.mp3","Po Cheng (Ritual Bell)","0","","","","",""
"796","5180","http://audio-tours.s3.amazonaws.com/w910.mp3","Kayagum (Zither)","0","","","","",""
"797","5898","http://audio-tours.s3.amazonaws.com/w911.mp3","Dragon Jar","0","","","","",""
"798","2814","http://audio-tours.s3.amazonaws.com/w911.mp3","Dragon Jar","0","","","","",""
"799","397","http://audio-tours.s3.amazonaws.com/w912.mp3","Tomb Guardian Figures","0","","","","",""
"800","3152","http://audio-tours.s3.amazonaws.com/w913.mp3","Horse by Herb Jackson","0","","","","",""
"801","98","http://audio-tours.s3.amazonaws.com/w914.mp3","Figure of God Harsiesis, Egyptian","0","","","","",""
"802","1230","http://audio-tours.s3.amazonaws.com/w915.mp3","False Door, Egyptian","0","","","","",""
"803","1358","http://audio-tours.s3.amazonaws.com/w917.mp3","Leopard, Benin","0","","","","",""
"804","4866","http://audio-tours.s3.amazonaws.com/w918.mp3","Shrine Head, Ife","0","","","","",""
"805","2275","http://audio-tours.s3.amazonaws.com/w919.mp3","Crown, Yoruba","0","","","","",""
"806","4684","http://audio-tours.s3.amazonaws.com/w920.mp3","Bamileke Elephant Mask","0","","","","",""
"807","5295","http://audio-tours.s3.amazonaws.com/w921.mp3","Throwing Blade, Fang-Kota","0","","","","",""
"808","1461","http://audio-tours.s3.amazonaws.com/w922.mp3","Black-figured Hydria, Greek","0","","","","",""
"809","4553","http://audio-tours.s3.amazonaws.com/w923.mp3","Transformation Mask, Kwakwaka'wakw (Kwakiutl)","0","","","","",""
"810","5299","http://audio-tours.s3.amazonaws.com/w924.mp3","Totem Pole, Haida","0","","","","",""
"811","3590","http://audio-tours.s3.amazonaws.com/w925.mp3","Shield  Attributed to Humped-Wolf","0","","","","",""
"812","11953","http://audio-tours.s3.amazonaws.com/w926.mp3","Untitled by Ernest Whiteman","0","","","","",""
"813","4797","http://audio-tours.s3.amazonaws.com/w927.mp3","Embroidered Box","0","","","","",""
"814","3764","http://audio-tours.s3.amazonaws.com/w928.mp3","Astronomical mantel timepiece by Jean-Antoine Lepine","0","","","","",""
"815","1629","http://audio-tours.s3.amazonaws.com/w931.mp3","Ganymede and the Eagle by Bertel Thorvaldsen","0","","","","",""
"816","4239","http://audio-tours.s3.amazonaws.com/w932.mp3","Portrait of the Gaspard Moeremans Family by François-Joseph Navez","0","","","","",""
"817","1738","http://audio-tours.s3.amazonaws.com/w933.mp3","Peace Concluded by Sir John Everett Millais, P. R. A.","0","","","","",""
"818","12092","http://audio-tours.s3.amazonaws.com/w934.mp3","Veiled Lady by Raffaelo Monti","0","","","","",""
"819","4196","http://audio-tours.s3.amazonaws.com/w936.mp3","Stampede by Harry Jackson","0","","","","",""
"820","2490","http://audio-tours.s3.amazonaws.com/w938.mp3","Tornado Over St. Paul by Julius Holm","0","","","","",""
"821","1503","http://audio-tours.s3.amazonaws.com/w939.mp3","The Spanish Playing Cards by Joan Miró","0","","","","",""
"822","10444","http://audio-tours.s3.amazonaws.com/w940.mp3","The Artist's Daughter, Julie, with her Nanny by Berthe Morisot","0","","","","",""
"823","1407","http://audio-tours.s3.amazonaws.com/w942.mp3","The Bagpiper by André Derain","0","","","","",""
"824","1800","http://audio-tours.s3.amazonaws.com/w943.mp3","The Intrigue by James Ensor","0","","","","",""
"825","5033","http://audio-tours.s3.amazonaws.com/w944.mp3","Aphrodisiac Telephone by Salvador Dali","0","","","","",""
"826","1278","http://audio-tours.s3.amazonaws.com/w945.mp3","Baboon and Young by Pablo Picasso","0","","","","",""
"827","1670","http://audio-tours.s3.amazonaws.com/w946.mp3","The Promenades of Euclid by René Magritte","0","","","","",""
"828","2241","http://audio-tours.s3.amazonaws.com/w946.mp3","Through Birds, Through Fire but Not Through Glass by Yves Tanguy","0","","","","",""
"829","2725","http://audio-tours.s3.amazonaws.com/w947.mp3","City Night by Georgia O'Keeffe","0","","","","",""
"830","1330","http://audio-tours.s3.amazonaws.com/w948.mp3","Billboard by Grace Hartigan","0","","","","",""
"831","2606","http://audio-tours.s3.amazonaws.com/w949.mp3","Vicki by Roy Lichtenstein","0","","","","",""
"832","1721","http://audio-tours.s3.amazonaws.com/w950.mp3","Frank by Chuck Close","0","","","","",""
"833","1425","http://audio-tours.s3.amazonaws.com/w951.mp3","Gross-Kromsdorf I by Lyonel Feininger","0","","","","",""
"834","1325","http://audio-tours.s3.amazonaws.com/w952.mp3","Carcass of Beef by Chaim Soutine","0","","","","",""
"835","4979","http://audio-tours.s3.amazonaws.com/w954.mp3","Standing Female Nude by Elie Nadelman","0","","","","",""
"836","10710","http://audio-tours.s3.amazonaws.com/w956.mp3","Henri Cartier-Bresson","0","","","","",""
